end_timestamp,start_timestamp,transcript
1958.38,1958.38,this is brown bread love it's made out of pizza or a yeast and then making out with do of recurrent list and then you have to bake it in the oven and then you can get it it's it's it's a it's an food item so you can have it in your breakfast lunch dinner whenever you
2030.562,2011.6619999999998,this is brown bread love it's made out of pizza or a yeast and then making out with do of recurrent list and then you have to bake it in the oven and then you can get it it's it's it's a it's an food item so you can have it in your breakfast lunch dinner whenever you
2062.708,2047.6580000000001,this is cabbage it can sometimes also be known as I spoke latest it's a vegetable and it's it's it's it's a used in salad and some other food dishes
2107.127,2093.857,this is the desert right Apple Pizza fruit and you can be solid faced
2146.852,2130.4519999999998,it today tomato it's it's also food and it's also used in salads and some other fruit
2170.036,2159.5460000000003,is it a white mug can be used to but have you what I have water or coffee or any kind of drink you want
2207.642,2197.102,this is all Gray colored ball this can be used to put your food in and this can also be used to store something else
2224.954,2219.974,I use bread cabbage Apple tomato unavoidable
